{
  "schema_version": "0.1",
  "identity": {
    "canonical_name": "pathlib",
    "spec_for_versions": ">=3.4",
    "api_header": "N/A — Python stdlib",
    "public_docs_url": "https://docs.python.org/3/library/pathlib.html"
  },
  "provenance": {
    "derived_from": [
      "Python 3 pathlib documentation — https://docs.python.org/3/library/pathlib.html",
      "Test vectors verified with Python 3.12 on macOS/Darwin 25.3.0, 2026-04-02"
    ],
    "not_derived_from": [
      "CPython pathlib source: Lib/pathlib/"
    ],
    "notes": [
      "All invariants use PurePosixPath — a pure, platform-independent class requiring no filesystem access.",
      "PurePosixPath is deterministic and safe to run anywhere; no real filesystem operations are performed.",
      "Dotted function names (e.g. 'PurePosixPath') are resolved by the harness via chained getattr from the module root.",
      "String coercion: PurePosixPath objects compare correctly against str via str() or the 'method: __str__' pattern."
    ],
    "created_at": "2026-04-02T00:00:00Z",
    "spec_authors": [
      "Theseus Z-layer"
    ]
  },
  "library": {
    "backend": "python_module",
    "module_name": "pathlib",
    "soname_patterns": []
  },
  "constants": {},
  "types": {},
  "wire_formats": {},
  "functions": {},
  "invariants": [
    {
      "id": "pathlib.purepath.name",
      "description": "python_call_eq: pathlib.purepath.name",
      "kind": "python_call_eq",
      "spec": {
        "function": "PurePosixPath",
        "args": [
          "/etc/passwd"
        ],
        "method": "name",
        "expected": "passwd"
      },
      "category": "components"
    },
    {
      "id": "pathlib.purepath.stem",
      "description": "python_call_eq: pathlib.purepath.stem",
      "kind": "python_call_eq",
      "spec": {
        "function": "PurePosixPath",
        "args": [
          "archive.tar.gz"
        ],
        "method": "stem",
        "expected": "archive.tar"
      },
      "category": "components"
    },
    {
      "id": "pathlib.purepath.suffix",
      "description": "python_call_eq: pathlib.purepath.suffix",
      "kind": "python_call_eq",
      "spec": {
        "function": "PurePosixPath",
        "args": [
          "archive.tar.gz"
        ],
        "method": "suffix",
        "expected": ".gz"
      },
      "category": "components"
    },
    {
      "id": "pathlib.purepath.suffixes",
      "description": "python_call_eq: pathlib.purepath.suffixes",
      "kind": "python_call_eq",
      "spec": {
        "function": "PurePosixPath",
        "args": [
          "archive.tar.gz"
        ],
        "method": "suffixes",
        "expected": [
          ".tar",
          ".gz"
        ]
      },
      "category": "components"
    },
    {
      "id": "pathlib.purepath.root",
      "description": "python_call_eq: pathlib.purepath.root",
      "kind": "python_call_eq",
      "spec": {
        "function": "PurePosixPath",
        "args": [
          "/etc/passwd"
        ],
        "method": "root",
        "expected": "/"
      },
      "category": "components"
    },
    {
      "id": "pathlib.purepath.no_suffix",
      "description": "python_call_eq: pathlib.purepath.no_suffix",
      "kind": "python_call_eq",
      "spec": {
        "function": "PurePosixPath",
        "args": [
          "Makefile"
        ],
        "method": "suffix",
        "expected": ""
      },
      "category": "components"
    },
    {
      "id": "pathlib.purepath.parent",
      "kind": "python_call_eq",
      "description": "python_call_eq: pathlib.purepath.parent",
      "category": "components",
      "spec": {
        "function": "PurePosixPath",
        "args": [
          "/etc/passwd"
        ],
        "method": "parent",
        "method_chain": "__str__",
        "expected": "/etc"
      }
    },
    {
      "id": "pathlib.purepath.parts",
      "kind": "python_call_eq",
      "description": "python_call_eq: pathlib.purepath.parts",
      "category": "components",
      "spec": {
        "function": "PurePosixPath",
        "args": [
          "/usr/bin/python"
        ],
        "method": "parts",
        "expected": [
          "/",
          "usr",
          "bin",
          "python"
        ]
      }
    },
    {
      "id": "pathlib.purepath.is_absolute",
      "kind": "python_call_eq",
      "description": "python_call_eq: pathlib.purepath.is_absolute",
      "category": "predicates",
      "spec": {
        "function": "PurePosixPath",
        "args": [
          "/etc/passwd"
        ],
        "method": "is_absolute",
        "expected": true
      }
    },
    {
      "id": "pathlib.purepath.is_relative_false",
      "kind": "python_call_eq",
      "description": "python_call_eq: pathlib.purepath.is_relative_false",
      "category": "predicates",
      "spec": {
        "function": "PurePosixPath",
        "args": [
          "relative/path"
        ],
        "method": "is_absolute",
        "expected": false
      }
    },
    {
      "id": "pathlib.purepath.with_suffix",
      "kind": "python_call_eq",
      "description": "python_call_eq: pathlib.purepath.with_suffix",
      "category": "manipulation",
      "spec": {
        "function": "PurePosixPath",
        "args": [
          "report.txt"
        ],
        "method": "with_suffix",
        "method_args": [
          ".md"
        ],
        "method_chain": "__str__",
        "expected": "report.md"
      }
    },
    {
      "id": "pathlib.purepath.with_name",
      "kind": "python_call_eq",
      "description": "python_call_eq: pathlib.purepath.with_name",
      "category": "manipulation",
      "spec": {
        "function": "PurePosixPath",
        "args": [
          "/etc/passwd"
        ],
        "method": "with_name",
        "method_args": [
          "shadow"
        ],
        "method_chain": "__str__",
        "expected": "/etc/shadow"
      }
    },
    {
      "id": "pathlib.purepath.joinpath",
      "kind": "python_call_eq",
      "description": "python_call_eq: pathlib.purepath.joinpath",
      "category": "joining",
      "spec": {
        "function": "PurePosixPath",
        "args": [
          "/etc"
        ],
        "method": "joinpath",
        "method_args": [
          "passwd"
        ],
        "method_chain": "__str__",
        "expected": "/etc/passwd"
      }
    },
    {
      "id": "pathlib.purepath.joinpath_slash",
      "kind": "python_call_eq",
      "description": "python_call_eq: pathlib.purepath.joinpath_slash",
      "category": "joining",
      "spec": {
        "function": "PurePosixPath",
        "args": [
          "/usr"
        ],
        "method": "__truediv__",
        "method_args": [
          "bin/python"
        ],
        "method_chain": "__str__",
        "expected": "/usr/bin/python"
      }
    },
    {
      "id": "pathlib.purepath.str",
      "kind": "python_call_eq",
      "description": "python_call_eq: pathlib.purepath.str",
      "category": "construction",
      "spec": {
        "function": "PurePosixPath",
        "args": [
          "/etc/passwd"
        ],
        "method": "__str__",
        "expected": "/etc/passwd"
      }
    },
    {
      "id": "pathlib.purepath.as_posix",
      "kind": "python_call_eq",
      "description": "python_call_eq: pathlib.purepath.as_posix",
      "category": "construction",
      "spec": {
        "function": "PurePosixPath",
        "args": [
          "/etc/passwd"
        ],
        "method": "as_posix",
        "expected": "/etc/passwd"
      }
    },
    {
      "id": "pathlib.purepath.relative_to",
      "kind": "python_call_eq",
      "description": "python_call_eq: pathlib.purepath.relative_to",
      "category": "manipulation",
      "spec": {
        "function": "PurePosixPath",
        "args": [
          "/etc/passwd"
        ],
        "method": "relative_to",
        "method_args": [
          "/etc"
        ],
        "method_chain": "__str__",
        "expected": "passwd"
      }
    }
  ],
  "error_model": {
    "return_code_semantics": "Python exceptions; raises on bad inputs; each call is stateless",
    "stream_error_field": "null",
    "error_stickiness": "N/A — each call is stateless",
    "error_codes": []
  }
}
