{
  "schema_version": "0.1",

  "identity": {
    "canonical_name": "curl",
    "spec_for_versions": ">=7.0.0",
    "api_header": "N/A — CLI tool",
    "public_docs_url": "https://curl.se/docs/manpage.html",
    "rfc_references": [
      {
        "rfc": "RFC 7230",
        "title": "HTTP/1.1 Message Syntax and Routing"
      },
      {
        "rfc": "RFC 3986",
        "title": "Uniform Resource Identifier (URI): Generic Syntax"
      }
    ]
  },

  "provenance": {
    "derived_from": [
      "curl man page — https://curl.se/docs/manpage.html",
      "curl --help output",
      "curl exit code reference — https://curl.se/docs/manpage.html#EXIT_CODES",
      "Test vectors verified with curl 8.13.0 on macOS/Darwin 25.3.0, 2026-03-31"
    ],
    "not_derived_from": [
      "curl source: lib/transfer.c, lib/url.c"
    ],
    "spec_authors": ["Theseus Z-layer"],
    "created_at": "2026-03-31T00:00:00Z",
    "notes": [
      "All invariants in this spec are offline-safe: they use --version, --help, file://, or connect to localhost on a port that is guaranteed to refuse connections. No external network access is required.",
      "Exit code 1 = unsupported protocol; exit code 7 = connection refused / failed to connect.",
      "file:// protocol is supported on all major platforms (macOS, Linux, FreeBSD).",
      "The stdin_b64 trick is not used here; curl reads from URLs, not stdin by default.",
      "version_string invariants test that key substrings appear in 'curl --version' stdout. The exact version number is intentionally not tested so the spec works across versions."
    ]
  },

  "library": {
    "backend": "cli",
    "command": "curl",
    "soname_patterns": [],
    "notes": "curl must be in PATH. Compatible with curl >= 7.0.0 (the file:// protocol and these exit codes have been stable for many years)."
  },

  "constants": {},
  "types": {},
  "functions": {},
  "wire_formats": {},

  "invariants": [
    {
      "id": "curl.version.exits_0",
      "description": "--version exits with code 0",
      "category": "health",
      "kind": "cli_exits_with",
      "spec": {
        "args": ["--version"],
        "expected_exit": 0
      }
    },
    {
      "id": "curl.version.contains_curl",
      "description": "--version stdout contains 'curl'",
      "category": "health",
      "kind": "cli_stdout_contains",
      "spec": {
        "args": ["--version"],
        "expected_substring": "curl"
      }
    },
    {
      "id": "curl.version.contains_libcurl",
      "description": "--version stdout contains 'libcurl'",
      "category": "health",
      "kind": "cli_stdout_contains",
      "spec": {
        "args": ["--version"],
        "expected_substring": "libcurl"
      }
    },
    {
      "id": "curl.version.contains_protocols",
      "description": "--version stdout contains 'Protocols:' listing",
      "category": "health",
      "kind": "cli_stdout_contains",
      "spec": {
        "args": ["--version"],
        "expected_substring": "Protocols:"
      }
    },
    {
      "id": "curl.version.contains_http",
      "description": "--version Protocols: section lists http",
      "category": "health",
      "kind": "cli_stdout_contains",
      "spec": {
        "args": ["--version"],
        "expected_substring": " http"
      }
    },
    {
      "id": "curl.help.exits_0",
      "description": "--help exits with code 0",
      "category": "health",
      "kind": "cli_exits_with",
      "spec": {
        "args": ["--help"],
        "expected_exit": 0
      }
    },
    {
      "id": "curl.help.contains_usage",
      "description": "--help stdout contains 'Usage:'",
      "category": "health",
      "kind": "cli_stdout_contains",
      "spec": {
        "args": ["--help"],
        "expected_substring": "Usage:"
      }
    },
    {
      "id": "curl.file.read_exits_0",
      "description": "curl can read a local file via file:// and exits 0",
      "category": "file_protocol",
      "kind": "cli_exits_with",
      "spec": {
        "args": ["--silent", "--output", "/dev/null", "file:///etc/hosts"],
        "expected_exit": 0
      }
    },
    {
      "id": "curl.file.read_stdout",
      "description": "curl file:// output contains the file contents",
      "category": "file_protocol",
      "kind": "cli_stdout_contains",
      "spec": {
        "args": ["--silent", "file:///etc/hosts"],
        "expected_substring": "localhost"
      }
    },
    {
      "id": "curl.error.unsupported_protocol_exits_1",
      "description": "An unsupported protocol scheme causes exit code 1",
      "category": "error_behavior",
      "kind": "cli_exits_with",
      "rfc_reference": "curl exit code 1 — unsupported protocol",
      "spec": {
        "args": ["--silent", "badproto://example.com"],
        "expected_exit": 1
      }
    },
    {
      "id": "curl.error.unsupported_protocol_stderr",
      "description": "An unsupported protocol scheme writes a message containing 'Protocol' to stderr",
      "category": "error_behavior",
      "kind": "cli_stderr_contains",
      "spec": {
        "args": ["badproto://example.com"],
        "expected_substring": "Protocol"
      }
    },
    {
      "id": "curl.error.connection_refused_exits_7",
      "description": "Connecting to a port with no listener exits with code 7 (connection refused)",
      "category": "error_behavior",
      "rfc_reference": "curl exit code 7 — failed to connect to host",
      "kind": "cli_exits_with",
      "spec": {
        "args": ["--silent", "--max-time", "2", "http://localhost:19999"],
        "expected_exit": 7,
        "timeout": 5
      }
    }
  ],

  "error_model": {
    "return_code_semantics": "0 = success; non-zero = failure. Key codes: 1 = unsupported protocol, 6 = couldn't resolve host, 7 = failed to connect, 22 = HTTP error with --fail, 28 = timeout.",
    "stream_error_field": "stderr",
    "error_stickiness": "N/A — each invocation is independent.",
    "error_codes": [
      {"name": "CURLE_OK",                    "value": 0,  "meaning": "No error"},
      {"name": "CURLE_UNSUPPORTED_PROTOCOL",  "value": 1,  "meaning": "The URL scheme is not supported"},
      {"name": "CURLE_COULDNT_RESOLVE_HOST",  "value": 6,  "meaning": "Couldn't resolve host name"},
      {"name": "CURLE_COULDNT_CONNECT",       "value": 7,  "meaning": "Failed to connect to host"},
      {"name": "CURLE_HTTP_RETURNED_ERROR",   "value": 22, "meaning": "HTTP response code ≥ 400 with --fail"},
      {"name": "CURLE_OPERATION_TIMEDOUT",    "value": 28, "meaning": "Operation timed out"}
    ]
  }
}
