{
  "schema_version": "0.1",
  "identity": {
    "canonical_name": "uuid",
    "spec_for_versions": ">=9.0.0",
    "api_header": "",
    "public_docs_url": "https://github.com/uuidjs/uuid#readme",
    "rfc_references": [
      {
        "rfc": "RFC 9562",
        "title": "Universally Unique IDentifiers (UUID) — https://www.rfc-editor.org/rfc/rfc9562"
      }
    ]
  },
  "provenance": {
    "derived_from": [
      "RFC 9562 — Universally Unique IDentifiers (UUID)",
      "uuid npm package README — https://github.com/uuidjs/uuid#readme",
      "Test vectors verified with uuid@13.x via Node.js 22.20.0 on macOS/Darwin 25.3.0, 2026-03-31"
    ],
    "not_derived_from": [
      "uuid package source"
    ],
    "notes": [
      "v4() is non-deterministic; its exact return value is not tested. Instead we test validate() and version() with fixed UUIDs.",
      "The NIL UUID '00000000-0000-0000-0000-000000000000' is version 0 per RFC 9562.",
      "UUID version numbers are encoded in the 13th hex digit of the standard string representation."
    ],
    "created_at": "2026-03-31T00:00:00Z",
    "spec_authors": [
      "Theseus Z-layer"
    ]
  },
  "library": {
    "backend": "cli",
    "command": "node",
    "module_name": "uuid",
    "soname_patterns": []
  },
  "constants": {},
  "types": {},
  "wire_formats": {},
  "functions": {},
  "invariants": [
    {
      "id": "uuid.validate.good_uuid",
      "description": "node_module_call_eq: uuid.validate.good_uuid",
      "kind": "node_module_call_eq",
      "spec": {
        "function": "validate",
        "args": [
          "550e8400-e29b-41d4-a716-446655440000"
        ],
        "expected": true,
        "rfc": "RFC 9562 §4"
      },
      "category": "validate"
    },
    {
      "id": "uuid.validate.nil_uuid",
      "description": "node_module_call_eq: uuid.validate.nil_uuid",
      "kind": "node_module_call_eq",
      "spec": {
        "function": "validate",
        "args": [
          "00000000-0000-0000-0000-000000000000"
        ],
        "expected": true,
        "rfc": "RFC 9562 §5.9"
      },
      "category": "validate"
    },
    {
      "id": "uuid.validate.garbage",
      "description": "node_module_call_eq: uuid.validate.garbage",
      "kind": "node_module_call_eq",
      "spec": {
        "function": "validate",
        "args": [
          "not-a-uuid"
        ],
        "expected": false
      },
      "category": "validate"
    },
    {
      "id": "uuid.validate.empty_string",
      "description": "node_module_call_eq: uuid.validate.empty_string",
      "kind": "node_module_call_eq",
      "spec": {
        "function": "validate",
        "args": [
          ""
        ],
        "expected": false
      },
      "category": "validate"
    },
    {
      "id": "uuid.validate.bad_version_digit",
      "description": "node_module_call_eq: uuid.validate.bad_version_digit",
      "kind": "node_module_call_eq",
      "spec": {
        "function": "validate",
        "args": [
          "550e8400-e29b-01d4-a716-446655440000"
        ],
        "expected": false
      },
      "category": "validate"
    },
    {
      "id": "uuid.version.v1_uuid",
      "description": "node_module_call_eq: uuid.version.v1_uuid",
      "kind": "node_module_call_eq",
      "spec": {
        "function": "version",
        "args": [
          "6ba7b810-9dad-11d1-80b4-00c04fd430c8"
        ],
        "expected": 1,
        "rfc": "RFC 9562 §5.1"
      },
      "category": "version"
    },
    {
      "id": "uuid.version.v4_uuid",
      "description": "node_module_call_eq: uuid.version.v4_uuid",
      "kind": "node_module_call_eq",
      "spec": {
        "function": "version",
        "args": [
          "f47ac10b-58cc-4372-a567-0e02b2c3d479"
        ],
        "expected": 4,
        "rfc": "RFC 9562 §5.4"
      },
      "category": "version"
    },
    {
      "id": "uuid.version.nil_is_version_0",
      "description": "node_module_call_eq: uuid.version.nil_is_version_0",
      "kind": "node_module_call_eq",
      "spec": {
        "function": "version",
        "args": [
          "00000000-0000-0000-0000-000000000000"
        ],
        "expected": 0,
        "rfc": "RFC 9562 §5.9"
      },
      "category": "version"
    }
  ],
  "error_model": {
    "return_code_semantics": "Functions return false/throw for invalid input. node exits 0 for all invariants in this spec.",
    "stream_error_field": "null",
    "error_stickiness": "N/A — each function call is stateless.",
    "error_codes": []
  }
}
